num,fichier_origine,nouveau_fichier,article_slug,type,role,alt
1,1.png,hero-alimentation-chat-adulte.png,alimentation-chat-adulte,PILIER,hero,"Plan rapproché en légère plongée d'un chat adulte roux mangeant avec appétit dans une gamelle basse posée sur un sol de cuisine chaleureux, museau dans l'assiette, posture concentrée, lumière naturelle douce du matin."
2,2.png,alimentation-chat-adulte-2.png,alimentation-chat-adulte,PILIER,secondaire,"Plan moyen d'un chat gris lapant de l'eau à une coupelle posée à l'écart de sa gamelle dans un coin calme du salon, langue tirée effleurant la surface, reflets doux, lumière naturelle latérale."
3,3.png,alimentation-chat-adulte-3.png,alimentation-chat-adulte,PILIER,secondaire,"Plan moyen d'un chat à la silhouette harmonieuse debout de profil sur un parquet clair, taille marquée bien visible, une main d'humain effleurant doucement son flanc pour palper les côtes, ambiance domestique sereine et lumineuse."
4,4.png,hero-besoins-nutritionnels-chat-carnivore.png,besoins-nutritionnels-chat-carnivore,SAT01,hero,"Plan rapproché d'un chat tigré fixant avec l'intensité du chasseur un morceau de viande ou une pâtée riche dans sa gamelle, museau frémissant, posture concentrée de prédateur, lumière chaude de cuisine."
5,5.png,besoins-nutritionnels-chat-carnivore-2.png,besoins-nutritionnels-chat-carnivore,SAT01,secondaire,"Plan moyen d'un chat adulte en pleine forme, pelage lustré et regard vif, assis bien droit sur un plaid clair près d'une fenêtre, illustrant un organisme dont les besoins sont bien couverts, lumière naturelle douce."
6,6.png,hero-croquettes-ou-patee-humide-sec-chat.png,croquettes-ou-patee-humide-sec-chat,SAT02,hero,"Plan rapproché en légère plongée d'un chat noir et blanc dégustant une pâtée onctueuse dans une assiette basse posée sur un carrelage de cuisine, museau luisant plongé dans la texture humide bien visible, lumière douce de fin de matinée."
7,7.png,croquettes-ou-patee-humide-sec-chat-2.png,croquettes-ou-patee-humide-sec-chat,SAT02,secondaire,"Plan moyen d'un chat tigré qui croque des croquettes dans un bol posé au sol d'un salon clair, une croquette visible près de la truffe, posture attentive et concentrée, lumière naturelle latérale du jour."
8,8.png,hero-hydratation-eau-chat.png,hydratation-eau-chat,SAT03,hero,"Plan rapproché d'un chat gris tigré buvant à une fontaine à eau posée au sol, filet d'eau qui coule le long de la coupelle, langue tendue vers le courant, reflets sur la surface, lumière douce et chaude d'un salon en fin de journée."
9,9.png,hydratation-eau-chat-2.png,hydratation-eau-chat,SAT03,secondaire,"Plan moyen d'un chat lapant à un large bol d'eau fraîche installé dans un coin calme du séjour, à l'écart de sa gamelle de nourriture, un autre point d'eau suggéré plus loin dans la pièce, ambiance domestique claire et lumineuse, langue effleurant la surface."
10,10.png,hero-frequence-rythme-repas-chat.png,frequence-rythme-repas-chat,SAT04,hero,"Plan moyen d'un chat crème cherchant des croquettes dispersées sur un tapis de fouille au sol d'un salon, patte engagée entre les plis du tissu, concentration de chasseur dans le regard, lumière naturelle douce de journée."
11,11.png,frequence-rythme-repas-chat-2.png,frequence-rythme-repas-chat,SAT04,secondaire,"Plan rapproché d'un chat roux extrayant une croquette d'une balle distributrice qu'il fait rouler du bout de la patte, mouvement suspendu dans le geste, intérieur chaleureux de journée, lumière douce."
12,12.png,hero-quelle-quantite-nourrir-chat.png,quelle-quantite-nourrir-chat,SAT05,hero,"Plan rapproché des mains d'un humain palpant délicatement les flancs d'un chat calme debout sur une table, geste doux d'évaluation de l'état corporel, ambiance sereine et lumineuse, lumière naturelle chaleureuse."
13,13.png,quelle-quantite-nourrir-chat-2.png,quelle-quantite-nourrir-chat,SAT05,secondaire,"Plan moyen d'une personne dosant la ration d'un chat à l'aide d'un verre mesureur au-dessus de la gamelle tandis que le chat attend à ses pieds, scène du quotidien, cuisine claire et lumineuse, aucune marque lisible."
14,14.png,hero-choisir-aliment-lire-etiquette-chat.png,choisir-aliment-lire-etiquette-chat,SAT06,hero,"Plan moyen d'une personne accroupie au rayon d'une animalerie, un paquet d'aliment pour chat à l'emballage neutre et sans marque lisible tenu à hauteur des yeux, lisant attentivement les mentions au dos, un chat assis à ses pieds levant la tête vers elle, lumière naturelle douce."
15,15.png,choisir-aliment-lire-etiquette-chat-2.png,choisir-aliment-lire-etiquette-chat,SAT06,secondaire,"Plan rapproché d'un chat en bonne santé au pelage brillant mangeant avec appétit dans une gamelle propre posée sur un sol clair, posture satisfaite et détendue, ambiance domestique soignée et lumineuse."
16,16.png,hero-surpoids-obesite-chat.png,surpoids-obesite-chat,SAT07,hero,"Plan moyen d'un chat à la silhouette ronde couché paisiblement sur un canapé clair, un maître bienveillant posant la main sur son flanc d'un geste attentif et tendre, ambiance douce et chaleureuse, lumière chaude de fin de journée, aucune dramatisation."
17,17.png,surpoids-obesite-chat-2.png,surpoids-obesite-chat,SAT07,secondaire,"Plan large dynamique d'un chat bondissant après un plumeau agité par son maître dans un salon lumineux, corps étiré en plein élan, pattes déployées, ambiance joyeuse et vive, lumière naturelle généreuse."
18,18.png,hero-chat-difficile-neophobie-alimentaire.png,chat-difficile-neophobie-alimentaire,SAT08,hero,"Plan rapproché d'un chat au poil clair reniflant avec circonspection une nouvelle gamelle posée au sol puis détournant légèrement la tête, expression de méfiance douce, scène pudique, lumière feutrée de cuisine."
19,19.png,chat-difficile-neophobie-alimentaire-2.png,chat-difficile-neophobie-alimentaire,SAT08,secondaire,"Plan moyen d'un maître accroupi présentant calmement une pâtée tiède à un chat qui s'en approche enfin avec intérêt, ambiance patiente et bienveillante, lumière chaude."
20,20.png,hero-friandises-extras-chat.png,friandises-extras-chat,SAT09,hero,"Plan rapproché d'une main tendant une petite friandise à un chat attentif qui la prend délicatement du bout du museau, oreilles dressées et regard concentré, moment de complicité et de confiance, lumière douce et dorée d'un salon en fin de journée."
21,21.png,friandises-extras-chat-2.png,friandises-extras-chat,SAT09,secondaire,"Plan moyen d'un chat concentré travaillant à extraire une friandise d'un jouet distributeur qu'il pousse du museau et de la patte sur le sol d'un salon chaleureux, posture attentive et ludique, tapis et meubles chaleureux en arrière-plan, lumière tamisée."
22,22.png,hero-aliments-dangereux-toxiques-chat.png,aliments-dangereux-toxiques-chat,SAT10,hero,"Plan moyen d'un chat curieux debout sur un plan de travail de cuisine clair, s'approchant d'aliments posés à côté de lui, quelques oignons et une tablette de chocolat, qu'une main d'humain écarte doucement pour les mettre à l'abri, geste calme et protecteur, lumière naturelle vive, ambiance rassurante."
23,23.png,aliments-dangereux-toxiques-chat-2.png,aliments-dangereux-toxiques-chat,SAT10,secondaire,"Plan rapproché d'un chat détourné avec douceur d'un plat couvert d'une cloche posé sur une table de salle à manger, la nourriture humaine hors de sa portée, cuisine rangée et nette en arrière-plan, atmosphère paisible et lumineuse."
24,24.png,hero-changer-alimentation-transition-chat.png,changer-alimentation-transition-chat,SAT11,hero,"Plan rapproché en plongée d'une gamelle basse où anciennes et nouvelles croquettes se mêlent en deux teintes distinctes bien reconnaissables, un chat au pelage clair museau au-dessus qui renifle avec attention, illustrant la transition progressive, lumière douce et naturelle."
25,25.png,changer-alimentation-transition-chat-2.png,changer-alimentation-transition-chat,SAT11,secondaire,"Plan moyen d'un chat au pelage sombre mangeant tranquillement son nouvel aliment dans une gamelle basse posée sur le sol d'une cuisine claire, posture détendue et confiante, queue au repos, après une transition réussie, lumière naturelle douce."
26,26.png,hero-erreurs-idees-recues-alimentation-chat.png,erreurs-idees-recues-alimentation-chat,SAT12,hero,"Plan moyen d'un chat détournant doucement la tête d'une soucoupe de lait qu'un maître retire délicatement de la main, scène pudique et tendre dans une cuisine, lumière chaude et dorée, ambiance domestique paisible."
27,27.png,erreurs-idees-recues-alimentation-chat-2.png,erreurs-idees-recues-alimentation-chat,SAT12,secondaire,"Plan rapproché d'un chat en pleine santé, au pelage lustré, mangeant avec appétit un aliment complet dans sa gamelle, posture sereine et détendue, lumière naturelle douce, ambiance d'intérieur chaleureuse."
